"Identificação da publicação","Identificação da conta","Nome de usuário da conta","Nome da conta",Descrição,"Duração (segundos)","Horário de publicação","Link permanente","Tipo de publicação","Comentário de dados",Data,Visualizações,Curtidas,Compartilhamentos,Comentários,Salvamentos,Alcance,Seguimentos
18056084636272180,17841407844868491,ufscaroficial,UFSCar,"A UFSCar já está lá na rede vizinha... vem conferir! 👀 Procure por UFSCar Oficial 😉

#ufscar #vídeos #universidadepublica",2,"04/23/2025 07:48",https://www.instagram.com/reel/DIywAgBp-9_/,"Reel do Instagram",,Vitalício,75830,1217,119,16,29,21543,2
18081588292847418,17841407844868491,ufscaroficial,UFSCar,"O Instituto de Estudos Avançados e Estratégicos (IEAE/UFSCar) acaba de abrir inscrições para a seleção de até 5 (cinco) propostas de Cátedras de Curta Duração, com vigência de 1 (um) ano a partir de março de 2026, conforme os termos do edital. 

As Cátedras são espaços acadêmicos voltados à produção de conhecimento de excelência, com impacto social e articulação entre diferentes áreas do saber. Coordenadas por uma ou um titular, elas operam em redes colaborativas formadas por pesquisadoras e pesquisadores da UFSCar e de instituições parceiras no Brasil e no exterior. 

Com forte caráter inter e transdisciplinar, e com o objetivo de fomentar pesquisas inovadoras, eventos científicos e ações formativas em temas de alta relevância social, científica e institucional. 

📚 Quer saber mais? Acesse o link na bio ou site do IEAE e confira o edital completo: https://www.ieae.ufscar.br/pt-br

#Oportunidades #UFSCar #CátedrasIEAE #UFSCar #CiênciaComImpacto #PesquisaAvançada #IEAEUFSCar",0,"06/30/2025 11:18",https://www.instagram.com/p/DLiOM4LA0Ce/,"Imagem do Instagram",,Vitalício,2071,18,1,1,4,1203,0
17909343750174159,17841447386220551,sibiufscar,"SIBi UFSCar","Encerramos hoje, 30 de junho de 2025, a primeira edição do Curso On-line de Iniciação em Pesquisa Científica!

Foram meses de aprendizado e troca, desde abril, com conteúdos sobre pesquisa científica, ética e disseminação do conhecimento.

Estudantes, docentes e técnicos de várias universidades do Brasil participaram dessa jornada, e tivemos o cuidado de garantir acessibilidade, com recursos como LIBRAS nas videoaulas.

Se você não conseguiu participar deste ciclo, não se preocupe! Novas edições do curso serão oferecidas no próximo ano. Acompanhe nossas divulgações!

Nosso agradecimento especial à Sead, CoSetils e Proex da UFSCar, e à Unifesp, pelo apoio essencial.

#ufscar #sibiufscar #bibliotecas #bibliotecasuniversitárias #bibliotecasufscar #sistemadebibliotecas #coinfo",107,"06/30/2025 09:00",https://www.instagram.com/reel/DLh-fCVgANg/,"Reel do Instagram",,Vitalício,1323,19,1,1,0,,
17993203508731980,17841407844868491,ufscaroficial,UFSCar,"📚💭 Como estão a saúde mental e os relacionamentos dos estudantes universitários no Brasil?

Uma pesquisa do Programa de Pós-Graduação em Psicologia da UFSCar quer entender os desafios que impactam a vida acadêmica, emocional e afetiva de estudantes de graduação em todo o país. O estudo aborda temas como saúde mental, desempenho acadêmico, vivências adversas e até o abuso digital em relacionamentos íntimos — uma realidade ainda pouco explorada no Brasil.

🎓💡 Se você é estudante de graduação, participe! A pesquisa é online, voluntária e anônima. Leva só de 25 a 30 minutos.

👉 Acesse: https://bit.ly/4k5UCr4

🔎 Mais informações no @laprevufscar ou pelo e-mail: projetoufscar2025@gmail.com.
 
Saiba mais no portal da UFSCar, em ufscar.br! 

#Pesquisa #SaúdeMental #VidaAcadêmica #UFSCar #Psicologia #ViolênciaDigital #Relacionamentos #Universitários",0,"06/30/2025 06:02",https://www.instagram.com/p/DLhqFhMga8A/,"Imagem do Instagram",,Vitalício,8637,166,21,0,4,5318,1
17869294860307049,17841407844868491,ufscaroficial,UFSCar,"Em 28 de junho celebramos o Dia Internacional do Orgulho LGBTQIA+, data que simboliza a luta por direitos civis, visibilidade e igualdade de pessoas lésbicas, gays, bissexuais, transexuais, queer, intersexo, assexuais e demais nomenclaturas da diversidade. Neste dia do Orgulho, a UFSCar reforça mais uma vez seu compromisso com a construção de uma universidade diversa e comprometida com a luta pela equidade.

A Administração Superior tem empenhado esforços nessa construção. Em 2023, aprovamos no Conselho Universitário (ConsUni) a Política de Prevenção, Redução e Mitigação de Danos da Violência, em 2024 aprovamos a Política de Identidade de Gênero da UFSCar e a Resolução ConsUni Nº 8/2024, que determina procedimentos em casos de diferentes tipos de violência, incluindo a de gênero e sexualidade. Recentemente, em abril de 2025, o ConsUni aprovou a Política de Acesso e Permanência de Pessoas Trans na Graduação. 

Por intermédio da Coordenadoria de Gênero e Diversidade da Secretaria Geral de Ações Afirmativas, Diversidade e Equidade (SAADE), temos desenvolvido campanhas institucionais contra a LGBTfobia, publicado cartilhas informativas e realizado atividades de formação e diálogo com a comunidade acadêmica. O Projeto de Desenvolvimento Institucional (ProDIn) Acolhe UFSCar, vinculado à Pró-Reitoria de Assuntos Comunitários e Estudantis (ProACE) também desenvolve ações de acolhimento da comunidade LGBTQIA+. 

As normativas e ações institucionais que temos desenvolvido são essenciais para que a UFSCar se transforme, mas ainda temos muito a avançar para garantir que a Universidade seja um lugar seguro e acolhedor para todas as pessoas. Por isso, seguiremos trabalhando para que nossa instituição respeite e reconheça toda a diversidade que compõe a sociedade brasileira e para que essas ações transbordem para o ambiente externo à nossa Universidade.

#pridemonth #orgulholgbt #ufscar",0,"06/28/2025 05:01",https://www.instagram.com/p/DLcZfbtsOsh/,"Imagem do Instagram",,Vitalício,22394,637,116,10,5,14249,2
17990574533672560,17841407844868491,ufscaroficial,UFSCar,"Nesta sexta-feira, 27/6, o Conselho Universitário (ConsUni) aprovou, com 39 votos favoráveis e uma abstenção, a proposta de concessão de título Doutora Honoris Causa à cantora, compositora, intelectual ativista e deputada estadual Leci Brandão.

A iniciativa de concessão do título partiu de uma comissão composta por docentes do Departamento de Ciências Sociais (DCSo), do Departamento de Artes e Comunicação (DAC), do Departamento de Letras (DL) e docentes da Universidade de Brasília (UnB) e da Universidade Federal de Mato Grosso (UFMT). A proposta já havia sido aprovada por aclamação pelo Conselho de Centro do CECH.

Mais informações: https://www.soc.ufscar.br/consuni/2025/arquivos/consuni-282/hc-leci.pdf",0,"06/27/2025 13:01",https://www.instagram.com/p/DLarmSXin2o/,"Imagem do Instagram",,Vitalício,25973,710,83,16,4,16097,1
17871607638387445,17841407844868491,ufscaroficial,UFSCar,"Nos dias 1 e 2 de julho, o Campus Sorocaba da UFSCar sedia a nona edição da Feira do Livro da EdUFSCar.

Participam da Feira as editoras Blucher, Boitempo, Catapulta, Companhia das Letras, Companhia das Letrinhas, Editora 34, Elefante, Grupo Pensamento, HarperCollins, L&PM, Parábola, Record, Rocco, Todavia, Unesp e Vozes. Os títulos dessas editoras estarão com 20% de desconto. Já os livros da EdUFSCar terão até 50%.

A Feira é aberta ao público e poderá ser visitada das 9 às 19h30, no saguão do Departamento de Geografia, Turismo e Humanidades (DGTH), Campus Sorocaba.",44,"06/27/2025 10:35",https://www.instagram.com/reel/DLaa0mdAifQ/,"Reel do Instagram",,Vitalício,6412,75,17,7,2,4434,0
18086183329739266,17841407844868491,ufscaroficial,UFSCar,"Está chegando! De 30 de junho a 4 de julho o Campus São Carlos recebe a 5ª edição do Festival Somos Cultura. Realizado pela Coordenadoria de Cultura (CCult) da Pró-Reitoria de Extensão (ProEx) da UFSCar com apoio de muitos setores e coletivos da Universidade, o evento retorna a São Carlos com uma programação diversa, celebrando a arte, a cultura e a potência da comunidade acadêmica. Nesta edição especial, o Festival celebra os 55 anos da UFSCar, promovendo um espaço de trocas, vivências e valorização da cultura em sua máxima expressão.

Todas as atividades são gratuitas e sem necessidade de inscrição prévia. Todas as oficinas e vivências oferecem certificado. A revista com a programação completa já está disponível e pode ser acessada em https://online.fliphtml5.com/osrhb/cjrw e no perfil @cultura_ufscar.

Além de participar das atividades, a partir da segunda-feira, dia 30, a comunidade UFSCar poderá acompanhar a cobertura do festival no perfil oficial da Universidade no Instagram, o @ufscaroficial, e no perfil da Coordenadoria de Cultura, o @cultura_ufscar. Participe também da cobertura marcando @ufscaroficial e @cultura_ufscar nas fotos e vídeos que você fizer durante o Somos Cultura!

Vai ser incrível! Participe!",0,"06/27/2025 09:03",https://www.instagram.com/p/DLaQXhRAa7Q/,"Carrossel do Instagram",,Vitalício,6980,86,8,1,4,2946,0
18104233426546977,17841407844868491,ufscaroficial,UFSCar,"🌱 Herbicida sustentável e seletivo!

Pesquisadores da UFSCar e de outras quatro universidades federais estão desenvolvendo um novo composto para o controle de plantas invasoras — com baixa toxicidade, alto poder de ação e produzido a partir de fontes renováveis 🌿

A pesquisa aposta em moléculas que desestabilizam a fotossíntese das invasoras, sem afetar as culturas agrícolas. E o melhor: tudo com matéria-prima vegetal, sem derivados do petróleo!

👨‍🔬 “Buscamos um herbicida que atinja apenas a planta indesejada, preservando o ambiente e a produção”, explica Marcio Paixão, docente da UFSCar e coordenador do projeto.

Assista ao vídeo completo no canal UFSCar Oficial no YouTube.

UFSCar #CiênciaBrasileira #AgroSustentável #Inovação #HerbicidaVerde",147,"06/27/2025 06:01",https://www.instagram.com/reel/DLZ7dD2gAiI/,"Reel do Instagram",,Vitalício,4599,86,14,2,1,3019,2
17910974943152497,17841407844868491,ufscaroficial,UFSCar,"#tbt Em 2023, a UFSCar promoveu a campanha ""Aprenda, ensine, violência é crime"", onde abordou diversos tipos de violência que ainda persistem na nossa sociedade. Neste mês do Orgulho LGBTQIA+ relembramos um dos vídeos dessa campanha, onde a nossa comunidade afirma: homofobia é crime! Denuncie!

#orgulholgbtq #ufscar #violencianao #homofobia",107,"06/26/2025 11:33",https://www.instagram.com/reel/DLX8PmnJi6o/,"Reel do Instagram",,Vitalício,8358,239,104,11,7,5214,0
17936266466922976,17841407844868491,ufscaroficial,UFSCar,"Uma pesquisa nacional na área da Psicologia, com participação de pesquisadores da UFSCar, está buscando adaptar, para a população brasileira, o RIAS-2, um instrumento amplamente utilizado para avaliar a inteligência de maneira geral, além de verificar como uma pessoa se lembra das coisas e a rapidez com que consegue resolver problemas.

Para isso, estudantes do curso de graduação em Psicologia da UFSCar, sob orientação da professora Monalisa Muniz, do Departamento de Psicologia (DPsi), estão convidando pessoas de 3 a 20 anos para participar do estudo, intitulado “Evidências de validade, precisão e estudos de normatização para a adaptação do instrumento RIAS-2”. 

📍 As aplicações são presenciais e acontecem em São Carlos e outras cidades do Estado de São Paulo.

📝 O teste dura cerca de 1 hora e os participantes poderão ter acesso ao resultado posteriormente.

💡 Interessados devem preencher o formulário no link: https://bit.ly/44tZphq

Saiba mais no portal da UFSCar, em ufscar.br! 

#Pesquisa #Psicologia #UFSCar #Inteligência #CIência",0,"06/26/2025 10:09",https://www.instagram.com/p/DLXzHQfAiDS/,"Imagem do Instagram",,Vitalício,6889,56,7,0,1,3702,0
18100121203499483,17841407844868491,ufscaroficial,UFSCar,"✨ 🌱 🌏 Chegou a vez do Campus Lagoa do Sino receber o BioFuturo Na Cidade. Neste sábado, 28 de junho, a partir das 7h30, as atividades do projeto serão realizadas no Lago Municipal de Campina do Monte Alegre. 

O projeto é uma ação do grupo de trabalho temático “Biodiversidade para o Futuro” do Instituto de Estudos Avançados e Estratégicos (IEAE), da UFSCar. O BioFuturo na Cidade propõe gerar mudanças e produzir conhecimentos acerca da biodiversidade e serviços ecossistêmicos das áreas verdes urbanas nas cidades. Confira no vídeo como foi a última edição do evento, em Sorocaba.

A programação completa da edição do BioFuturo Na Cidade, em Campina do Monte Alegre está disponível no perfil @biofuturonacidade. Confira. 

💚 Participe do BioFuturo Na Cidade e descubra como a natureza vive e resiste no espaço urbano! 

#biodiversidade #ciência #BioFuturoNaCidade #biologia
#cienciacidada",178,"06/26/2025 06:06",https://www.instagram.com/reel/DLXXIWagev3/,"Reel do Instagram",,Vitalício,4923,83,9,4,1,3221,0
17916760554077033,17841407844868491,ufscaroficial,UFSCar,"🚀 A UFSCar alcançou seu melhor resultado no THE Impact Rankings 2025, que avalia o impacto social e ambiental das universidades com base nos ODS da ONU! 🌍✨

🌱 Quer saber como a gente chegou lá?

➡️ Passe para o lado e confira os destaques!

Para saber mais, acesse a matéria completa no portal da UFSCar, em ufscar.br. 

#UFSCar #ODS #THEImpactRankings #Agenda2030 #UniversidadePública",0,"06/25/2025 10:57",https://www.instagram.com/p/DLVT0-VgVgx/,"Carrossel do Instagram",,Vitalício,38879,963,247,18,45,17031,16
18088217044660979,17841407844868491,ufscaroficial,UFSCar,"A Universidade Federal de São Carlos (UFSCar) está oferecendo vagas de Residências Médicas e Multiprofissionais em Saúde para início em 2026. O processo seletivo será por meio do Exame Nacional de Residências (Enare) e as inscrições poderão ser realizadas no período de 7 a 18 de julho para as Residências Médicas e de hoje, 25 de junho, a 18 de julho para as Residências Multiprofissionais.

Ao todo, são 43 vagas, sendo 14 vagas para as Residências Médicas, distribuídas entre os Programas de Residência Médica em Clínica Médica, Pediatria, Medicina de Família e Comunidade e Psiquiatria, e 29 vagas para as Residências Multiprofissionais, distribuídas entre os Programas de Residência Multiprofissional em Saúde da Família, Atenção à Saúde Mental e Atenção à Saúde do Adulto e Idoso.

Os editais com as informações completas estão acessíveis no site do Enare (https://enare.ebserh.gov.br).",0,"06/25/2025 09:00",https://www.instagram.com/p/DLVGf64ggH-/,"Imagem do Instagram",,Vitalício,18870,208,110,0,26,11331,10
17981607434835534,17841407844868491,ufscaroficial,UFSCar,"Histórias que fazem a UFSCar

Sabrina Campos é egressa do curso de Agroecologia da UFSCar, campus Araras. Durante a graduação se descobriu apaixonada no curso que escolheu e hoje percebe o quanto amadureceu durante sua trajetória acadêmica 

As oportunidades que viveu dentro da UFSCar, de grupos de estudos a empresa Júnior, foram o subsídio para sua formação pessoal e profissional.

Sabrina destaca a importância da plataforma Alumni para quem já passou pela UFSCar e quem está chegando agora: “Ver o que o egresso está fazendo, no que está trabalhando, conseguir se basear [...] eu acho que isso abre um leque de opções, principalmente para você se relacionar, ver aquilo que você quer para sua vida”.

📲 cadastre-se na Alumni UFSCar e faça parte dessa rede que conecta histórias, conquistas e oportunidades! 

🌐 acesse alumni.ufscar.br

Uma vez UFSCar, sempre UFSCar!

#SouAlumniUFSCar",221,"06/25/2025 05:56",https://www.instagram.com/reel/DLUxQPaAKN6/,"Reel do Instagram",,Vitalício,6471,108,7,4,1,3913,6
18138161251412867,17841407844868491,ufscaroficial,UFSCar,"Há muitas possibilidades para quem quer trabalhar na área ambiental! Na UFSCar, um dos caminhos é o curso de Engenharia Ambiental oferecido no campus Lagoa do Sino. Neste vídeo que o estudante e bolsista do projeto UFSCar Escola Gabriel Sanefuji fez pra gente, você fica sabendo de tudo sobre o curso! Vem ver!

#ufscar #ufscarlagoadosino #engenhariaambiental #visauniversitaria #vlog

------------
Ficha técnica:
Produção, roteiro, imagens e edição de Gabriel Sanefuji @gab.sanne
Supervisão de Agnes Arato (CCS-UFSCar)",135,"06/24/2025 11:41",https://www.instagram.com/reel/DLSzujPJxGu/,"Reel do Instagram",,Vitalício,7485,126,13,1,3,4203,0
18079244911847623,17841407844868491,ufscaroficial,UFSCar,"🪟🐦 Colisões de aves com vidraças: um problema invisível, mas alarmante!

Um estudo internacional, com participação do professor Augusto João Piratelli, do Campus Sorocaba da UFSCar, resultou no maior banco de dados já compilado sobre o tema na região Neotropical — que vai do México à Patagônia.

Os dados revelam que, ao contrário do que se pensa, a maioria dos acidentes não acontece em grandes prédios, mas em construções baixas, como casas, áreas rurais e universidades. No Brasil, o Campus Sorocaba da UFSCar é referência nesse monitoramento e no teste de soluções preventivas.

A pesquisa destaca ainda a necessidade urgente de políticas públicas que considerem a realidade da nossa região e ajudem a tornar as cidades mais seguras para as aves e para toda a biodiversidade.

📊 O banco de dados está disponível em acesso aberto na plataforma Zenodo e pode apoiar decisões mais eficazes!

Para mais informações, acesse o portal da UFSCar em ufscar.br! 

#UFSCar #Ciência #Conservação #Aves #Biodiversidade #MeioAmbiente #Pesquisa",0,"06/24/2025 06:01",https://www.instagram.com/p/DLSNNbKMzdI/,"Imagem do Instagram",,Vitalício,40406,1147,156,27,48,27531,46
18047338859621606,17841466938456731,lagoadosino_ufscar,"Lagoa do Sino - UFSCar","🎓🌱 Dia Internacional das Mulheres na Engenharia | 23 de Junho

Maria Heloísa e Maria Júlia são estudantes de Engenharia Agronômica no Campus Lagoa do Sino da UFSCar. Filhas de agricultores e ex-alunas de escola pública, elas são as primeiras da família a ingressar em uma universidade pública.

A trajetória dessas jovens mostra como a parceria entre escola pública e universidade pode abrir caminhos e transformar vidas. 🌟

💬 “Estar aqui é a realização de um sonho.”

No Dia Internacional das Mulheres na Engenharia, celebramos histórias como a delas — que nos lembram da força, da dedicação e do papel fundamental das mulheres na construção de um futuro mais justo, sustentável e igualitário. 💪🏽👩🏽🔬🌾

-
Ficha técnica:
Imagens e entrevistas: Maria Alice Pezzoni e Tiago Santi 
Direção: Tiago Santi
Coordenação geral: Agnes Arato

#MulheresNaEngenharia #UFSCar #LagoaDoSino #TransformaçãoPelaEducação #OrgulhoUFSCar",100,"06/23/2025 05:42",https://www.instagram.com/reel/DLPl1SJAN5H/,"Reel do Instagram",,Vitalício,21024,577,64,36,0,,
17964841886781860,17841407844868491,ufscaroficial,UFSCar,"Se a polícia é um tema relativamente novo entre os historiadores, estava quase intocado o problema levantado neste livro, o do surgimento da polícia e da segurança pública em meio ao regime escravista que vigorava no Brasil do século XIX. Em ""Policiar nos tempos da escravidão"", a historiadora Larissa Biato de Azevedo explica a criação de cargos e funções policiais, a organização da Polícia e analisa as ocorrências envolvendo escravos, libertos e africanos livres tratadas pelas autoridades da época. Ao mobilizar variadas fontes para entender a relação entre o dever de policiar, a nascente ideia de segurança pública e a escravidão, este livro provoca uma reflexão sobre a polícia no tempo e traz uma necessária leitura sobre a instituição no Brasil Império.

A obra está disponível no site da EdUFSCar: https://edufscar.com.br",61,"06/20/2025 05:39",https://www.instagram.com/reel/DLH3Y9jgRWd/,"Reel do Instagram",,Vitalício,9862,210,37,12,17,6236,2
18103415293549020,17841407844868491,ufscaroficial,UFSCar,"Planejando começar o mestrado ou o doutorado ainda esse ano, ou iniciar os seus estudos como aluno especial? Então, não deixe de conferir a lista com os programas com edital publicado e/ou inscrições abertas nos campi São Carlos e Sorocaba da UFSCar. 

Acesse em: https://bit.ly/mestrado-doutorado-na-ufscar ou visite o Portal da UFSCar: www.ufscar.br.",0,"06/19/2025 06:00",https://www.instagram.com/p/DLFVJC3CL8e/,"Imagem do Instagram",,Vitalício,31786,790,137,10,104,22472,90
18143022358395894,17841407844868491,ufscaroficial,UFSCar,"Você tem vontade de empreender? Conhece as oportunidades que a UFSCar oferece para isso?

Fernando Guerreiro é egresso do curso de Ciências Econômicas da UFSCar Sorocaba e atualmente é aluno de mestrado do Programa de Pós-Graduação de Ciência, Tecnologia e Sociedade de São Carlos.
Ingressou na graduação em 2019 e fundou a Liga do Empreendedorismo que se desdobrou em uma rede composta por mais de 100 universidades do Brasil. 
A partir dessa iniciativa, ampliou seu vínculo com a UFSCar, através do Departamento de Computação do campus São Carlos e explorou a multidisciplinaridade dos campi ao fazer seu TCC, com orientadores desses dois departamentos, desdobrando em seu atual projeto de mestrado.

“E o legal da UFSCar é isso, eu tive minha formação, minha graduação lá em Sorocaba e agora eu também tenho oportunidade de me conectar com esses outros professores de São Carlos”, relatou Fernando.

Seu Trabalho de Conclusão de Curso foi um modelo piloto para avaliar como a Universidade impacta através das empresas filhas, empresas fundadas por pessoas que têm vínculo com a Universidade – concluindo que a Plataforma Alumni UFSCar amplia as possibilidades de conexão de iniciativas como essa

📲 cadastre-se na Alumni UFSCar e faça parte dessa rede que conecta histórias, conquistas e oportunidades! 

🌐 acesse alumni.ufscar.br

Uma vez UFSCar, sempre UFSCar!

#SouAlumniUFSCar",302,"06/18/2025 09:59",https://www.instagram.com/reel/DLDLYiDgl6F/,"Reel do Instagram",,Vitalício,8240,134,17,7,8,4991,1
18468403171075245,17841407844868491,ufscaroficial,UFSCar,"Grafismo indígena no Campus Sorocaba!!

O Campus Sorocaba da UFSCar inaugura a primeira manifestação artística indígena no Campus. O grafismo foi concebido por Reginaldo Ramos (@mahsakura), artista e aluno do curso de Engenharia Florestal. 

A iniciativa é uma forma de marcar a presença de estudantes indígenas na Universidade, e trazer uma maior representatividade e pluralidade para a UFSCar. 

Vamos prestigiar o belo trabalho! 
--
Ficha técnica
Entrevistas: Daniela Milani 
Imagens: Daniela Milani e Giovanna Consorti 
Edição: Fabricio Mazocco
Direção: Agnes Arato

#grafismo #grafismoindigena #indígenas #ufscarsorocaba",91,"06/18/2025 06:20",https://www.instagram.com/reel/DLCyQ2AA-Ei/,"Reel do Instagram",,Vitalício,8517,279,40,29,4,5262,2
18029746946481677,17841466938456731,lagoadosino_ufscar,"Lagoa do Sino - UFSCar","🌱 Projeto Transição Tropical em Lagoa do Sino anuncia resultados e bolsas de Mestrado e IC🌾

No último dia 12/06, o Projeto Transição Tropical, desenvolvido na Fazenda Escola Lagoa do Sino (FELS), apresentou os resultados do seu 3º ciclo e anunciou uma grande novidade: bolsas de mestrado, iniciação científica e iniciação científica júnior para pesquisas alinhadas aos objetivos do projeto! 👩🏽🔬👨🏻🌾

A iniciativa, que busca transformar o modelo agrícola com base na agricultura regenerativa e orgânica, agora conta com R$ 400 mil em recursos vindos de emenda do deputado federal @guilhermeboulos.oficial 💰🌿

🧪 As inscrições para as bolsas vão até 27 de junho, e os editais já estão disponíveis no site da FELS (Link clicável nos stories). Os projetos devem se alinhar a uma das linhas temáticas:

(i) Biodiversidade
(ii) Sustentabilidade
(iii) Sociedade
(iv) Produção de Alimentos
(v) Alimentos Saudáveis

Essa é uma realização da FELS (@felsufscar) em parceria com o Instituto Folio (@folio.organicos), com apoio dos Institutos Ibirapitanga (@iibirapitanga) e Itaúsa (@itausaholding), além de diversos parceiros institucionais e tecnológicos.

🔗 Confira todos os detalhes no site da FELS e leia a matéria completa no Portal da UFSCar!

#TransiçãoTropical #LagoaDoSino #UFSCar #Agroecologia #AgriculturaRegenerativa #Ciência #IniciaçãoCientífica #Mestrado #BolsasDePesquisa",0,"06/17/2025 09:54",https://www.instagram.com/p/DLAmSQUA0cK/,"Imagem do Instagram",,Vitalício,8796,116,15,0,0,,
18012467723570592,17841407844868491,ufscaroficial,UFSCar,"Atenção, estudantes da UFSCar! Estão abertas as inscrições para a seleção de trabalhos que representarão a universidade nas 32ª Jornadas de Jovens Pesquisadores da AUGM, que acontecerão de 5 a 7 de novembro, na Universidad Nacional de Tucumán (Argentina)! 🇦🇷✨

📌 Podem participar alunos de graduação e pós-graduação, com trabalhos de pesquisa.

🗓️ Inscrições até 27 de junho, às 18h. Estudantes selecionados terão auxílio para viagem e estadia! 💸✈️

📑 Confira os editais no site da SRInter: www.srinter.ufscar.br

📬 Dúvidas? jornadas.augm.srinter@ufscar.br

Para mais informações, acesse o portal da UFSCar em ufscar.br! 

#UFSCar #SRInter #ProPG #AUGM #JornadasDeJovensPesquisadores #Pesquisa #CiênciaSemFronteiras #MobilidadeAcadêmica",0,"06/17/2025 06:00",https://www.instagram.com/p/DLALiJniR0x/,"Imagem do Instagram",,Vitalício,10858,107,15,1,8,7212,0
